ResponseID,ResponseSet,IPAddress,StartDate,EndDate,RecipientLastName,RecipientFirstName,RecipientEmail,ExternalDataReference,Finished,Status,Q2_1_1,Q2_1_2,Q2_1_3,Q2_1_4,Q2_2_1,Q2_2_2,Q2_2_3,Q2_2_4,Q2_3_1,Q2_3_2,Q2_3_3,Q2_3_4,Q4_1_10,Q4_1_11,Q4_1_12,Q4_1_13,Q4_2_10,Q4_2_11,Q4_2_12,Q4_2_13,Q4_3_10,Q4_3_11,Q4_3_12,Q4_3_13,Q3_question_one_1,Q3_question_one_2,Q3_question_one_3,Q3_question_one_4,Q3_question_two_1,Q3_question_two_2,Q3_question_two_3,Q3_question_two_4,Q3_question_three_1,Q3_question_three_2,Q3_question_three_3,Q3_question_three_4,Q5_question_one_10,Q5_question_one_11,Q5_question_one_12,Q5_question_one_13,Q5_question_two_10,Q5_question_two_11,Q5_question_two_12,Q5_question_two_13,Q5_question_three_10,Q5_question_three_11,Q5_question_three_12,Q5_question_three_13,matrix_question_five_question_one_10,matrix_question_five_question_one_11,matrix_question_five_question_one_12,matrix_question_five_question_one_13,matrix_question_five_question_two_10,matrix_question_five_question_two_11,matrix_question_five_question_two_12,matrix_question_five_question_two_13,matrix_question_five_question_two_TEXT,matrix_question_five_question_three_10,matrix_question_five_question_three_11,matrix_question_five_question_three_12,matrix_question_five_question_three_13,LocationLatitude,LocationLongitude,LocationAccuracy
ResponseID,ResponseSet,IPAddress,StartDate,EndDate,RecipientLastName,RecipientFirstName,RecipientEmail,ExternalDataReference,Finished,Status,Click to write the question text-Click to write Statement 1-Click to write Scale point 1,Click to write the question text-Click to write Statement 1-Click to write Scale point 2,Click to write the question text-Click to write Statement 1-Click to write Scale point 3,Click to write the question text-Click to write Statement 1-Click to write Scale point 4,Click to write the question text-Click to write Statement 2-Click to write Scale point 1,Click to write the question text-Click to write Statement 2-Click to write Scale point 2,Click to write the question text-Click to write Statement 2-Click to write Scale point 3,Click to write the question text-Click to write Statement 2-Click to write Scale point 4,Click to write the question text-Click to write Statement 3-Click to write Scale point 1,Click to write the question text-Click to write Statement 3-Click to write Scale point 2,Click to write the question text-Click to write Statement 3-Click to write Scale point 3,Click to write the question text-Click to write Statement 3-Click to write Scale point 4,"Click to write the question text This question has variables given for its RecodeValues, aka, Sca...-Click to write Statement 1-Click to write Scale point 1","Click to write the question text This question has variables given for its RecodeValues, aka, Sca...-Click to write Statement 1-Click to write Scale point 2","Click to write the question text This question has variables given for its RecodeValues, aka, Sca...-Click to write Statement 1-Click to write Scale point 3","Click to write the question text This question has variables given for its RecodeValues, aka, Sca...-Click to write Statement 1-Click to write Scale point 4","Click to write the question text This question has variables given for its RecodeValues, aka, Sca...-Click to write Statement 2-Click to write Scale point 1","Click to write the question text This question has variables given for its RecodeValues, aka, Sca...-Click to write Statement 2-Click to write Scale point 2","Click to write the question text This question has variables given for its RecodeValues, aka, Sca...-Click to write Statement 2-Click to write Scale point 3","Click to write the question text This question has variables given for its RecodeValues, aka, Sca...-Click to write Statement 2-Click to write Scale point 4","Click to write the question text This question has variables given for its RecodeValues, aka, Sca...-Click to write Statement 3-Click to write Scale point 1","Click to write the question text This question has variables given for its RecodeValues, aka, Sca...-Click to write Statement 3-Click to write Scale point 2","Click to write the question text This question has variables given for its RecodeValues, aka, Sca...-Click to write Statement 3-Click to write Scale point 3","Click to write the question text This question has variables given for its RecodeValues, aka, Sca...-Click to write Statement 3-Click to write Scale point 4","Click to write the question text This question has variables given for its Question Export Tags,...-Click to write Statement 1-Click to write Scale point 1","Click to write the question text This question has variables given for its Question Export Tags,...-Click to write Statement 1-Click to write Scale point 2","Click to write the question text This question has variables given for its Question Export Tags,...-Click to write Statement 1-Click to write Scale point 3","Click to write the question text This question has variables given for its Question Export Tags,...-Click to write Statement 1-Click to write Scale point 4","Click to write the question text This question has variables given for its Question Export Tags,...-Click to write Statement 2-Click to write Scale point 1","Click to write the question text This question has variables given for its Question Export Tags,...-Click to write Statement 2-Click to write Scale point 2","Click to write the question text This question has variables given for its Question Export Tags,...-Click to write Statement 2-Click to write Scale point 3","Click to write the question text This question has variables given for its Question Export Tags,...-Click to write Statement 2-Click to write Scale point 4","Click to write the question text This question has variables given for its Question Export Tags,...-Click to write Statement 3-Click to write Scale point 1","Click to write the question text This question has variables given for its Question Export Tags,...-Click to write Statement 3-Click to write Scale point 2","Click to write the question text This question has variables given for its Question Export Tags,...-Click to write Statement 3-Click to write Scale point 3","Click to write the question text This question has variables given for its Question Export Tags,...-Click to write Statement 3-Click to write Scale point 4",Click to write the question text This question has variables given for both its Choices and Answe...-Click to write Statement 1-Click to write Scale point 1,Click to write the question text This question has variables given for both its Choices and Answe...-Click to write Statement 1-Click to write Scale point 2,Click to write the question text This question has variables given for both its Choices and Answe...-Click to write Statement 1-Click to write Scale point 3,Click to write the question text This question has variables given for both its Choices and Answe...-Click to write Statement 1-Click to write Scale point 4,Click to write the question text This question has variables given for both its Choices and Answe...-Click to write Statement 2-Click to write Scale point 1,Click to write the question text This question has variables given for both its Choices and Answe...-Click to write Statement 2-Click to write Scale point 2,Click to write the question text This question has variables given for both its Choices and Answe...-Click to write Statement 2-Click to write Scale point 3,Click to write the question text This question has variables given for both its Choices and Answe...-Click to write Statement 2-Click to write Scale point 4,Click to write the question text This question has variables given for both its Choices and Answe...-Click to write Statement 3-Click to write Scale point 1,Click to write the question text This question has variables given for both its Choices and Answe...-Click to write Statement 3-Click to write Scale point 2,Click to write the question text This question has variables given for both its Choices and Answe...-Click to write Statement 3-Click to write Scale point 3,Click to write the question text This question has variables given for both its Choices and Answe...-Click to write Statement 3-Click to write Scale point 4,This is a multiple answer likert matrix question with text entry and survey logic in two respecti...-Click to write Statement 1-Click to write Scale point 1,This is a multiple answer likert matrix question with text entry and survey logic in two respecti...-Click to write Statement 1-Click to write Scale point 2,This is a multiple answer likert matrix question with text entry and survey logic in two respecti...-Click to write Statement 1-Click to write Scale point 3,This is a multiple answer likert matrix question with text entry and survey logic in two respecti...-Click to write Statement 1-Click to write Scale point 4,This is a multiple answer likert matrix question with text entry and survey logic in two respecti...-Click to write Statement 2-Click to write Scale point 1,This is a multiple answer likert matrix question with text entry and survey logic in two respecti...-Click to write Statement 2-Click to write Scale point 2,This is a multiple answer likert matrix question with text entry and survey logic in two respecti...-Click to write Statement 2-Click to write Scale point 3,This is a multiple answer likert matrix question with text entry and survey logic in two respecti...-Click to write Statement 2-Click to write Scale point 4,This is a multiple answer likert matrix question with text entry and survey logic in two respecti...-Click to write Statement 2,This is a multiple answer likert matrix question with text entry and survey logic in two respecti...-Click to write Statement 3-Click to write Scale point 1,This is a multiple answer likert matrix question with text entry and survey logic in two respecti...-Click to write Statement 3-Click to write Scale point 2,This is a multiple answer likert matrix question with text entry and survey logic in two respecti...-Click to write Statement 3-Click to write Scale point 3,This is a multiple answer likert matrix question with text entry and survey logic in two respecti...-Click to write Statement 3-Click to write Scale point 4,LocationLatitude,LocationLongitude,LocationAccuracy
{'ImportId': 'responseId'},{'ImportId': 'responseSetId'},{'ImportId': 'ipAddress'},{'ImportId': 'startDate'},{'ImportId': 'endDate'},{'ImportId': 'panel-RecipientLastName'},{'ImportId': 'panel-RecipientFirstName'},{'ImportId': 'panel-RecipientEmail'},{'ImportId': 'panel-ExternalDataReference'},{'ImportId': 'finished'},{'ImportId': 'status'},{'ImportId': 'QID2-1-1'},{'ImportId': 'QID2-1-2'},{'ImportId': 'QID2-1-3'},{'ImportId': 'QID2-1-4'},{'ImportId': 'QID2-2-1'},{'ImportId': 'QID2-2-2'},{'ImportId': 'QID2-2-3'},{'ImportId': 'QID2-2-4'},{'ImportId': 'QID2-3-1'},{'ImportId': 'QID2-3-2'},{'ImportId': 'QID2-3-3'},{'ImportId': 'QID2-3-4'},{'ImportId': 'QID5-1-1'},{'ImportId': 'QID5-1-2'},{'ImportId': 'QID5-1-3'},{'ImportId': 'QID5-1-4'},{'ImportId': 'QID5-2-1'},{'ImportId': 'QID5-2-2'},{'ImportId': 'QID5-2-3'},{'ImportId': 'QID5-2-4'},{'ImportId': 'QID5-3-1'},{'ImportId': 'QID5-3-2'},{'ImportId': 'QID5-3-3'},{'ImportId': 'QID5-3-4'},{'ImportId': 'QID3-1-1'},{'ImportId': 'QID3-1-2'},{'ImportId': 'QID3-1-3'},{'ImportId': 'QID3-1-4'},{'ImportId': 'QID3-2-1'},{'ImportId': 'QID3-2-2'},{'ImportId': 'QID3-2-3'},{'ImportId': 'QID3-2-4'},{'ImportId': 'QID3-3-1'},{'ImportId': 'QID3-3-2'},{'ImportId': 'QID3-3-3'},{'ImportId': 'QID3-3-4'},{'ImportId': 'QID6-1-1'},{'ImportId': 'QID6-1-2'},{'ImportId': 'QID6-1-3'},{'ImportId': 'QID6-1-4'},{'ImportId': 'QID6-2-1'},{'ImportId': 'QID6-2-2'},{'ImportId': 'QID6-2-3'},{'ImportId': 'QID6-2-4'},{'ImportId': 'QID6-3-1'},{'ImportId': 'QID6-3-2'},{'ImportId': 'QID6-3-3'},{'ImportId': 'QID6-3-4'},{'ImportId': 'QID4-1-1'},{'ImportId': 'QID4-1-2'},{'ImportId': 'QID4-1-3'},{'ImportId': 'QID4-1-4'},{'ImportId': 'QID4-2-1'},{'ImportId': 'QID4-2-2'},{'ImportId': 'QID4-2-3'},{'ImportId': 'QID4-2-4'},{'ImportId': 'QID4-2-TEXT'},{'ImportId': 'QID4-3-1'},{'ImportId': 'QID4-3-2'},{'ImportId': 'QID4-3-3'},{'ImportId': 'QID4-3-4'},{'ImportId': 'Location-LocationLatitude'},{'ImportId': 'Location-LocationLongitude'},{'ImportId': 'Location-LocationAccuracy'}
R_8i9uJcWSX3p4lX7,Default Response Set,,2016-05-27 10:45:04,2016-05-27 10:45:04,,,,,1,2,1,,,1,,1,,1,1,,,,1,1,1,1,,1,1,1,1,1,1,1,,,1,1,1,,,,1,,,,1,1,1,1,,,1,1,,,,1,1,1,,,1,,1,,Dolorem suspendisse porta ultrices mi nec consequat aenean dictumst wisi euismod massa consequat.,1,1,1,1,42.401901245117,-71.119300842285,-1
R_37NR2pKb6RD1lqd,Default Response Set,,2016-05-27 10:45:04,2016-05-27 10:45:05,,,,,1,2,,1,,1,1,1,1,1,1,,,1,,,,1,1,1,1,,,1,,,1,1,1,1,1,,,1,,,1,,1,,,,1,1,,1,,1,1,,,1,1,1,1,1,1,1,Dapibus. Fringilla dapibus vestibulum. Dapibus. Accumsan diam aliquet per sapien! Duis nullam. Nullam lacus consequat.,,1,,1,42.401901245117,-71.119300842285,-1
R_cSn4Q5nnQesVhmB,Default Response Set,,2016-05-27 10:45:05,2016-05-27 10:45:05,,,,,1,2,,1,1,1,1,1,,1,1,,1,1,1,1,1,1,,1,,1,1,1,1,1,1,,1,1,1,1,1,1,1,1,,1,1,1,,1,,1,1,,1,1,1,1,,,,1,1,1,1,,Fusce ipsum turpis ullamcorper. Velit a auctor. Facilisi vestibulum curabitur etiam.,,,1,1,42.401901245117,-71.119300842285,-1
R_4VGkAqAMkvjFhSl,Default Response Set,,2016-05-27 10:45:05,2016-05-27 10:45:05,,,,,1,2,,,1,,1,,1,1,,1,1,1,1,1,,,1,1,1,1,1,1,1,1,1,1,1,,,1,,,1,,1,,,1,1,1,,,1,1,,1,1,,1,,1,,1,1,,1,Quam primis. Consequat eleifend montes ut orci ab vivamus accumsan facilisi accusamus.,1,,1,1,42.401901245117,-71.119300842285,-1
R_2ugh5IsUaTm6Y2V,Default Response Set,,2016-05-27 10:45:05,2016-05-27 10:45:05,,,,,1,2,1,,1,1,,,1,,1,,,1,,1,,,,,,1,1,1,1,1,1,1,1,1,1,1,1,,,,1,1,1,,1,1,,,1,,,,,1,,,1,1,1,1,1,1,Vivamus sollicitudin elementum bibendum nec venenatis? Tincidunt eros nulla sagittis.,1,1,,1,42.401901245117,-71.119300842285,-1
