V1,V2,V3,V4,V5,V6,V7,V8,V9,V10,Q2_1,Q2_2,Q2_3,Q4_1,Q4_2,Q4_3,Q3_1,Q3_2,Q3_3,Q3_4,Q3_5,Q5_1,Q5_2,Q5_3,Q5_4,Q5_5,Q5_6,Q5_7,mc_question_five_1,mc_question_five_2,mc_question_five_2_TEXT,mc_question_five_3,LocationLatitude,LocationLongitude,LocationAccuracy,
ResponseID,ResponseSet,Name,ExternalDataReference,EmailAddress,IPAddress,Status,StartDate,EndDate,Finished,Click to write the question text-Click to write Statement 1,Click to write the question text-Click to write Statement 2,Click to write the question text-Click to write Statement 3,Click to write the question text This question has custom RecodeValues-Click to write Statement 1,Click to write the question text This question has custom RecodeValues-Click to write Statement 2,Click to write the question text This question has custom RecodeValues-Click to write Statement 3,"Click to write the question text This question has choice groups, one after the first choice and...-Click to write Statement 1","Click to write the question text This question has choice groups, one after the first choice and...-Click to write Statement 2","Click to write the question text This question has choice groups, one after the first choice and...-Click to write Statement 3","Click to write the question text This question has choice groups, one after the first choice and...-Click to write Choice 2","Click to write the question text This question has choice groups, one after the first choice and...-Click to write Choice 5",Click to write the question text This question has both choice groups and recoded values for the...-Click to write Statement 1,Click to write the question text This question has both choice groups and recoded values for the...-Click to write Statement 2,Click to write the question text This question has both choice groups and recoded values for the...-Click to write Statement 3,Click to write the question text This question has both choice groups and recoded values for the...-Click to write Choice 4,Click to write the question text This question has both choice groups and recoded values for the...-Click to write Choice 5,Click to write the question text This question has both choice groups and recoded values for the...-Click to write Choice 6,Click to write the question text This question has both choice groups and recoded values for the...-Click to write Choice 7,This is a multiple answer likert matrix question with text entry and survey logic in two respecti...-Click to write Statement 1,This is a multiple answer likert matrix question with text entry and survey logic in two respecti...-Click to write Statement 2,This is a multiple answer likert matrix question with text entry and survey logic in two respecti...-Click to write Statement 2-TEXT,This is a multiple answer likert matrix question with text entry and survey logic in two respecti...-Click to write Statement 3,LocationLatitude,LocationLongitude,LocationAccuracy,
R_bIVJQDOvulWU4BL,Default Response Set,Anonymous,,,,2,2016-05-27 11:51:26,2016-05-27 11:51:26,1,,1,1,1,,1,,1,1,1,,1,,,,,1,,,1,Gravida pellentesque consectetuer eleifend risus fusce sit urna diam magnis laoreet.,1,42.401901245117,-71.119300842285,-1,
R_9TRMTVrcxToobFX,Default Response Set,Anonymous,,,,2,2016-05-27 11:51:26,2016-05-27 11:51:26,1,1,1,1,1,,1,,1,1,1,,,1,1,1,,1,1,,1,"Massa rutrum! Magna tempor sodales potenti augue mauris. Praesent viverra? Vitae, dapibus a.",1,42.401901245117,-71.119300842285,-1,
R_0wwjWTTwZZ0Yk5L,Default Response Set,Anonymous,,,,2,2016-05-27 11:51:27,2016-05-27 11:51:27,1,1,1,1,1,1,1,,,1,,1,1,,,,,1,,,1,Montes elementum. Aenean pretium fermentum mauris tincidunt natoque purus duis nulla temporibus? Aliquam. Placerat.,1,42.401901245117,-71.119300842285,-1,
R_6L5kIRYklhmFwEd,Default Response Set,Anonymous,,,,2,2016-05-27 11:51:27,2016-05-27 11:51:27,1,1,1,1,1,,1,,1,1,,1,1,1,1,1,1,1,1,,1,"Non, et tempor. Praesent amet molestie sollicitudin magna integer justo. Lacus. Dolorem eget nec.",1,42.401901245117,-71.119300842285,-1,
R_5d5Farh7brTe56d,Default Response Set,Anonymous,,,,2,2016-05-27 11:51:27,2016-05-27 11:51:27,1,1,,1,1,1,1,,1,1,1,1,1,1,1,,,1,,,1,Urna imperdiet dictumst tincidunt egestas maecenas consectetuer aliquet urna vivamus.,1,42.401901245117,-71.119300842285,-1,
